{
  "$schema": "https://json-schema.org/draft/2020-12/schema",
  "$id": "https://schemas.atlas-systems.uk/policy/v1/backup-audit.schema.json",
  "title": "Atlas Systems backup audit policy v1",
  "type": "object",
  "additionalProperties": false,
  "required": [
    "schema_version",
    "owner",
    "reviewed_at",
    "mode",
    "guardrails",
    "eligibility",
    "service_coverage",
    "targets"
  ],
  "properties": {
    "schema_version": {"const": "atlas-backup-audit/policy/v1"},
    "owner": {"const": "AtlasReaper311/atlas-infra"},
    "reviewed_at": {"type": "string", "format": "date-time"},
    "mode": {"const": "fixture-only"},
    "guardrails": {
      "type": "object",
      "additionalProperties": false,
      "required": [
        "offline_only",
        "provider_reads",
        "provider_writes",
        "live_restore",
        "allow_policy_commands",
        "allow_existing_restore_paths",
        "cleanup_temporary_directories",
        "maximum_archive_files",
        "maximum_uncompressed_bytes"
      ],
      "properties": {
        "offline_only": {"const": true},
        "provider_reads": {"const": false},
        "provider_writes": {"const": false},
        "live_restore": {"const": false},
        "allow_policy_commands": {"const": false},
        "allow_existing_restore_paths": {"const": false},
        "cleanup_temporary_directories": {"const": true},
        "maximum_archive_files": {"type": "integer", "minimum": 1, "maximum": 10000},
        "maximum_uncompressed_bytes": {"type": "integer", "minimum": 1024, "maximum": 1073741824}
      }
    },
    "eligibility": {
      "type": "object",
      "additionalProperties": false,
      "required": ["excluded_lifecycles", "excluded_provenance", "excluded_services"],
      "properties": {
        "excluded_lifecycles": {
          "type": "array",
          "minItems": 2,
          "uniqueItems": true,
          "items": {"enum": ["archived", "deprecated"]}
        },
        "excluded_provenance": {
          "type": "array",
          "minItems": 1,
          "uniqueItems": true,
          "items": {"const": "external-derived"}
        },
        "excluded_services": {
          "type": "array",
          "minItems": 1,
          "uniqueItems": true,
          "items": {"const": "simple-proxy"}
        }
      }
    },
    "service_coverage": {
      "type": "array",
      "minItems": 1,
      "uniqueItems": true,
      "items": {"$ref": "#/$defs/service_coverage"}
    },
    "targets": {
      "type": "array",
      "minItems": 4,
      "uniqueItems": true,
      "items": {"$ref": "#/$defs/target"}
    }
  },
  "$defs": {
    "service_id": {
      "type": "string",
      "pattern": "^[a-z0-9]+(?:-[a-z0-9]+)*$",
      "maxLength": 64
    },
    "repository": {
      "type": "string",
      "pattern": "^AtlasReaper311/[A-Za-z0-9._-]+$",
      "maxLength": 128
    },
    "relative_path": {
      "type": "string",
      "pattern": "^(?!/)(?!.*(?:^|/)\\.\\.(?:/|$))(?!.*\\\\)[A-Za-z0-9._/-]+$",
      "maxLength": 240
    },
    "relative_markdown": {
      "type": "string",
      "pattern": "^(?!/)(?!.*(?:^|/)\\.\\.(?:/|$))[A-Za-z0-9._/-]+\\.md$",
      "maxLength": 240
    },
    "classification": {
      "type": "object",
      "additionalProperties": false,
      "required": ["lifecycle", "scope", "provenance"],
      "properties": {
        "lifecycle": {"enum": ["production", "active", "experimental", "deprecated", "archived"]},
        "scope": {"enum": ["public", "internal"]},
        "provenance": {"enum": ["original", "external-derived"]}
      }
    },
    "service_coverage": {
      "type": "object",
      "additionalProperties": false,
      "required": ["service_id", "repository", "state", "target_ids", "rationale", "notes"],
      "properties": {
        "service_id": {"$ref": "#/$defs/service_id"},
        "repository": {"$ref": "#/$defs/repository"},
        "state": {"enum": ["target", "no-backup-rationale", "not-declared", "excluded"]},
        "target_ids": {
          "type": "array",
          "maxItems": 20,
          "uniqueItems": true,
          "items": {"$ref": "#/$defs/service_id"}
        },
        "rationale": {"type": ["string", "null"], "minLength": 1, "maxLength": 500},
        "notes": {"type": "string", "minLength": 1, "maxLength": 500}
      },
      "allOf": [
        {
          "if": {"properties": {"state": {"const": "target"}}},
          "then": {"properties": {"target_ids": {"minItems": 1}}}
        },
        {
          "if": {"properties": {"state": {"const": "no-backup-rationale"}}},
          "then": {"properties": {"rationale": {"type": "string", "minLength": 1}}}
        }
      ]
    },
    "target": {
      "type": "object",
      "additionalProperties": false,
      "required": [
        "target_id",
        "service_id",
        "repository",
        "data_type",
        "storage_type",
        "owner",
        "classification",
        "backup_frequency_hours",
        "maximum_allowed_age_hours",
        "recovery_point_objective_hours",
        "recovery_time_objective_hours",
        "retention_expectation_days",
        "restore_drill_type",
        "disposable_restore_location",
        "evidence_source",
        "required_metadata_fields",
        "runbook_reference",
        "criticality",
        "enabled",
        "fixture_only",
        "notes"
      ],
      "properties": {
        "target_id": {"$ref": "#/$defs/service_id"},
        "service_id": {"$ref": "#/$defs/service_id"},
        "repository": {"$ref": "#/$defs/repository"},
        "data_type": {
          "enum": ["github-workflow-artifact", "cloudflare-kv-export", "incident-export", "chroma-vector-store-export"]
        },
        "storage_type": {
          "enum": ["github-actions-artifact", "cloudflare-kv", "json-export", "chroma-vector-store"]
        },
        "owner": {"type": "string", "minLength": 1, "maxLength": 120},
        "classification": {"$ref": "#/$defs/classification"},
        "backup_frequency_hours": {"type": "integer", "minimum": 1, "maximum": 8760},
        "maximum_allowed_age_hours": {"type": "integer", "minimum": 1, "maximum": 8760},
        "recovery_point_objective_hours": {"type": "integer", "minimum": 1, "maximum": 8760},
        "recovery_time_objective_hours": {"type": "integer", "minimum": 1, "maximum": 8760},
        "retention_expectation_days": {"type": "integer", "minimum": 1, "maximum": 3650},
        "restore_drill_type": {
          "enum": ["artifact-metadata-validation", "json-export-validation", "chroma-fixture-validation", "archive-extraction"]
        },
        "disposable_restore_location": {"const": "system-temporary-directory"},
        "evidence_source": {"$ref": "#/$defs/relative_path"},
        "required_metadata_fields": {
          "type": "array",
          "minItems": 8,
          "maxItems": 20,
          "uniqueItems": true,
          "items": {
            "enum": [
              "backup_at",
              "digest",
              "evidence_ref",
              "expected_file_count",
              "expected_total_size_bytes",
              "observed_at",
              "repository",
              "restore_source",
              "retention",
              "service_id",
              "source_type",
              "target_id"
            ]
          }
        },
        "runbook_reference": {"$ref": "#/$defs/relative_markdown"},
        "criticality": {"enum": ["low", "medium", "high", "critical"]},
        "enabled": {"type": "boolean"},
        "fixture_only": {"const": true},
        "notes": {"type": "string", "minLength": 1, "maxLength": 500}
      }
    }
  }
}
